{
  "rate_elapsed_ns": [
    1000803507,
    2000363455,
    3000202191,
    4000643363,
    5001008350,
    6000991080,
    7000987526,
    8000206839,
    9000295086,
    10000257267,
    11000777588,
    12000567958,
    13000287537,
    14000108558,
    15000825441,
    16000527992,
    17000200682,
    18000346896,
    19000715668,
    20000178638,
    21000627513,
    22000814965,
    23000104298,
    24000390991,
    25000804093,
    26000688341,
    27000656942,
    28000178243,
    29001018726,
    30000455328,
    31000736349,
    32000676250,
    33000213916,
    34000298731,
    35000504175,
    36000306254,
    37001045734,
    38000253048,
    39000230390,
    40000753438,
    41000495081,
    42000103242,
    43000312483,
    44000993566,
    45000332754,
    46000560572,
    47000696528,
    48000219370,
    49000417062,
    50001028789,
    51000455416,
    52000596642,
    53001067096,
    54000987505,
    55000084317,
    56000363793,
    57000959074,
    58000040081,
    59000361009,
    60000198677,
    61000852560,
    62000822889,
    63000264698,
    64001034750,
    65000208053,
    66001002268,
    67000686125,
    68000348151,
    69000389878,
    70000549771,
    71000927048,
    72000709504,
    73000275361,
    74001004459,
    75000774518,
    76000470753,
    77000561990,
    78000379614,
    79000347982,
    80000120725,
    81000532222,
    82000499276,
    83000116747,
    84000805796,
    85000743071,
    86000919977,
    87000262093,
    88000209443,
    89000281548,
    90000936509,
    91000878990,
    92000471512,
    93000731936,
    94000193648,
    95000102782,
    96000580085,
    97000916743,
    98000705937,
    99000193346,
    100000740387,
    101000088552,
    102000213185,
    103000837857,
    104000964251,
    105000254639,
    106000296098,
    107000658554,
    108001017781,
    109000145480,
    110000169322,
    111000789440,
    112000902719,
    113000321748,
    114000541692,
    115000385684,
    116000593586,
    117000479457,
    118000783841,
    119000673641,
    120000155745,
    121000268789,
    122000159944,
    123000590897,
    124001064669,
    125000134365,
    126001044062,
    127000566096,
    128000306529,
    129001034319,
    130000870030,
    131000370571,
    132000870993,
    133000857209,
    134001004561,
    135001060463,
    136000330370,
    137000317906,
    138001069365,
    139000528656,
    140000614094,
    141001035313,
    142000656501,
    143000643417,
    144000447175,
    145000303441,
    146000103385,
    147000751132,
    148000573468,
    149000923562,
    150000055348,
    151001052311,
    152000307142,
    153000621257,
    154000151663,
    155000813297,
    156000162380,
    157000191711,
    158000154612,
    159000819830,
    160000804876,
    161000676021,
    162000090424,
    163001052726,
    164000671912,
    165000461889,
    166000831671,
    167000445195,
    168000832599,
    169000264133,
    170000359646,
    171000494822,
    172000951076,
    173000122907,
    174000868205,
    175000249013,
    176000354668,
    177000543747,
    178000324187,
    179000608952,
    180000837819,
    181000712842,
    182000258501,
    183000672361,
    184000943470,
    185000601260,
    186000898883,
    187000357214,
    188000452327,
    189000921513,
    190000364794,
    191000247525,
    192000706576,
    193000256139,
    194000222034,
    195000789899,
    196001032978,
    197000229519,
    198001070030,
    199000791408,
    200000956785,
    201000234647,
    202000609828,
    203000225178,
    204000953514,
    205000871816,
    206000197193,
    207001008538,
    208000868353,
    209000290907,
    210000574584,
    211001061378,
    212000955591,
    213000509174,
    214000692072,
    215000741651,
    216000696209,
    217001037649,
    218000325796,
    219000641372,
    220000979654,
    221000399991,
    222000515193,
    223000167451,
    224000409957,
    225000892761,
    226000900697,
    227000481450,
    228000408233,
    229000291535,
    230000727048,
    231000876893,
    232000508480,
    233000291361,
    234000984491,
    235000040886,
    236000780207,
    237000632849,
    238000590590,
    239001008118,
    240000689142,
    241000880086,
    242000308958,
    243000603126,
    244000588809,
    245000306969,
    246000567461,
    247000260764,
    248000821707,
    249000491513,
    250000867491,
    251000427725,
    252000950742,
    253000125709,
    254000831598,
    255000287498,
    256000819912,
    257000931023,
    258000456297,
    259000945764,
    260000407267,
    261001072089,
    262000951628,
    263000257123,
    264000695336,
    265000947150,
    266000750479,
    267000623889,
    268000447548,
    269000878988,
    270000719783,
    271000792310,
    272000086730,
    273000743424,
    274000610765,
    275000682445,
    276000181887,
    277000289274,
    278000310184,
    279000290156,
    280000314261,
    281000378860,
    282000089782,
    283000401284,
    284000345561,
    285000319241,
    286000801678,
    287000743022,
    288000362756,
    289000917192,
    290000329966,
    291000154987,
    292000351886,
    293000149490,
    294000298617,
    295000744385,
    296000686656,
    297000121347,
    298000582339,
    299000864628,
    300000808281
  ],
  "rate_duration_ns": [
    1000803507,
    999559948,
    999838736,
    1000441172,
    1000364987,
    999982730,
    999996446,
    999219313,
    1000088247,
    999962181,
    1000520321,
    999790370,
    999719579,
    999821021,
    1000716883,
    999702551,
    999672690,
    1000146214,
    1000368772,
    999462970,
    1000448875,
    1000187452,
    999289333,
    1000286693,
    1000413102,
    999884248,
    999968601,
    999521301,
    1000840483,
    999436602,
    1000281021,
    999939901,
    999537666,
    1000084815,
    1000205444,
    999802079,
    1000739480,
    999207314,
    999977342,
    1000523048,
    999741643,
    999608161,
    1000209241,
    1000681083,
    999339188,
    1000227818,
    1000135956,
    999522842,
    1000197692,
    1000611727,
    999426627,
    1000141226,
    1000470454,
    999920409,
    999096812,
    1000279476,
    1000595281,
    999081007,
    1000320928,
    999837668,
    1000653883,
    999970329,
    999441809,
    1000770052,
    999173303,
    1000794215,
    999683857,
    999662026,
    1000041727,
    1000159893,
    1000377277,
    999782456,
    999565857,
    1000729098,
    999770059,
    999696235,
    1000091237,
    999817624,
    999968368,
    999772743,
    1000411497,
    999967054,
    999617471,
    1000689049,
    999937275,
    1000176906,
    999342116,
    999947350,
    1000072105,
    1000654961,
    999942481,
    999592522,
    1000260424,
    999461712,
    999909134,
    1000477303,
    1000336658,
    999789194,
    999487409,
    1000547041,
    999348165,
    1000124633,
    1000624672,
    1000126394,
    999290388,
    1000041459,
    1000362456,
    1000359227,
    999127699,
    1000023842,
    1000620118,
    1000113279,
    999419029,
    1000219944,
    999843992,
    1000207902,
    999885871,
    1000304384,
    999889800,
    999482104,
    1000113044,
    999891155,
    1000430953,
    1000473772,
    999069696,
    1000909697,
    999522034,
    999740433,
    1000727790,
    999835711,
    999500541,
    1000500422,
    999986216,
    1000147352,
    1000055902,
    999269907,
    999987536,
    1000751459,
    999459291,
    1000085438,
    1000421219,
    999621188,
    999986916,
    999803758,
    999856266,
    999799944,
    1000647747,
    999822336,
    1000350094,
    999131786,
    1000996963,
    999254831,
    1000314115,
    999530406,
    1000661634,
    999349083,
    1000029331,
    999962901,
    1000665218,
    999985046,
    999871145,
    999414403,
    1000962302,
    999619186,
    999789977,
    1000369782,
    999613524,
    1000387404,
    999431534,
    1000095513,
    1000135176,
    1000456254,
    999171831,
    1000745298,
    999380808,
    1000105655,
    1000189079,
    999780440,
    1000284765,
    1000228867,
    999875023,
    999545659,
    1000413860,
    1000271109,
    999657790,
    1000297623,
    999458331,
    1000095113,
    1000469186,
    999443281,
    999882731,
    1000459051,
    999549563,
    999965895,
    1000567865,
    1000243079,
    999196541,
    1000840511,
    999721378,
    1000165377,
    999277862,
    1000375181,
    999615350,
    1000728336,
    999918302,
    999325377,
    1000811345,
    999859815,
    999422554,
    1000283677,
    1000486794,
    999894213,
    999553583,
    1000182898,
    1000049579,
    999954558,
    1000341440,
    999288147,
    1000315576,
    1000338282,
    999420337,
    1000115202,
    999652258,
    1000242506,
    1000482804,
    1000007936,
    999580753,
    999926783,
    999883302,
    1000435513,
    1000149845,
    999631587,
    999782881,
    1000693130,
    999056395,
    1000739321,
    999852642,
    999957741,
    1000417528,
    999681024,
    1000190944,
    999428872,
    1000294168,
    999985683,
    999718160,
    1000260492,
    999693303,
    1000560943,
    999669806,
    1000375978,
    999560234,
    1000523017,
    999174967,
    1000705889,
    999455900,
    1000532414,
    1000111111,
    999525274,
    1000489467,
    999461503,
    1000664822,
    999879539,
    999305495,
    1000438213,
    1000251814,
    999803329,
    999873410,
    999823659,
    1000431440,
    999840795,
    1000072527,
    999294420,
    1000656694,
    999867341,
    1000071680,
    999499442,
    1000107387,
    1000020910,
    999979972,
    1000024105,
    1000064599,
    999710922,
    1000311502,
    999944277,
    999973680,
    1000482437,
    999941344,
    999619734,
    1000554436,
    999412774,
    999825021,
    1000196899,
    999797604,
    1000149127,
    1000445768,
    999942271,
    999434691,
    1000460992,
    1000282289,
    999943653
  ],